{
  "$schema": "https://json-schema.org/draft/2020-12/schema",
  "$id": "https://agentic-workflow.local/schemas/fleet-state.schema.json",
  "title": "fleet state file",
  "description": "One session's state, written by the aw:fleet hook at $AW_FLEET_DIR/<provider>/<sessionId>.json (spec 2026-10-16-sindri-session-collector-design.md section 5.1). The provider field and the directory name are the catalog's AgentId (claude-code, never claude); the hook maps AW_HOOK_PROVIDER (unset or claude -> claude-code). Validate with Ajv2020.",
  "type": "object",
  "additionalProperties": false,
  "required": ["schema", "provider", "sessionId", "event", "state", "at", "cwd", "transcript", "agentPid", "agentStartTicks", "env"],
  "properties": {
    "schema": { "const": 1 },
    "provider": {
      "type": "string",
      "pattern": "^[a-z][a-z0-9-]{1,31}$",
      "description": "An AgentId (launcher.schema.json $defs.agentId)."
    },
    "sessionId": {
      "type": "string",
      "pattern": "^[A-Za-z0-9][A-Za-z0-9._-]{0,127}$",
      "description": "Checked against the generic id pattern before the write."
    },
    "event": {
      "type": "string",
      "maxLength": 64,
      "pattern": "^[A-Za-z][A-Za-z0-9_]*$",
      "description": "The event as the canonical hook sees it (the adapters' Claude-shaped name)."
    },
    "state": { "enum": ["running", "asking", "idle", "ended"] },
    "reason": { "enum": ["approval", "input", "auth"], "description": "asking only." },
    "tool": {
      "type": "string",
      "maxLength": 64,
      "pattern": "^[A-Za-z0-9_.:-]+$",
      "description": "approval only: the tool name. Never tool_input."
    },
    "at": {
      "type": "string",
      "pattern": "^[0-9]{4}-[0-9]{2}-[0-9]{2}T[0-9]{2}:[0-9]{2}:[0-9]{2}(\\.[0-9]{1,3})?Z$"
    },
    "cwd": { "type": "string", "minLength": 1 },
    "transcript": { "type": ["string", "null"], "minLength": 1 },
    "agentPid": { "type": ["integer", "null"], "minimum": 1 },
    "agentStartTicks": { "type": ["integer", "null"], "minimum": 0 },
    "env": {
      "type": "object",
      "description": "macOS only (spec 4.4): the allowlisted names; {} on Linux.",
      "propertyNames": { "pattern": "^[A-Z][A-Z0-9_]*$" },
      "additionalProperties": { "type": "string" }
    }
  },
  "allOf": [
    {
      "if": { "properties": { "state": { "const": "asking" } }, "required": ["state"] },
      "then": { "required": ["reason"] },
      "else": { "not": { "anyOf": [{ "required": ["reason"] }, { "required": ["tool"] }] } }
    },
    {
      "if": { "required": ["tool"] },
      "then": { "properties": { "reason": { "const": "approval" } }, "required": ["reason"] }
    },
    {
      "if": { "properties": { "agentPid": { "type": "integer" } }, "required": ["agentPid"] },
      "then": { "properties": { "agentStartTicks": { "type": "integer" } } },
      "else": { "properties": { "agentStartTicks": { "type": "null" } } }
    }
  ]
}
